{"$schema":"https://dsh-evolve-le.local/schemas/candidate.manifest.schema.json","schemaVersion":1,"canonicalParent":"sha256:c7306e0424bfd95bf7c687afe26de48954ba99e6cca88b35330b87e53e14c716","donorCandidates":[],"proposal":{"hypothesis":"Grounding the solve prompt in the verifier's expected artifact path, contents and format makes the agent produce the checked deliverable rather than a generic reply.","evidenceRefs":["evidence://export/a62d1cffa9c8de3ff2dd6470c211477f2b57fa102d998d9ac316c1c1995589a6"],"targetFailureModes":["reward-0-artifact-not-produced"],"expectedBehaviorChange":"Solve-mode prompt now directs the agent to create the exact artifact the verifier checks and confirm its contents before finishing.","regressionRisks":[],"touchedSurfaces":["system-prompt"]},"runtime":{"requiredServices":["systemPrompt"],"optionalServices":[],"newToolNames":[],"supportsModes":["solve","propose"],"promptSections":{"solve":[{"name":"candidate:identity","order":100}],"propose":[{"name":"candidate:proposal-policy","order":100}]}},"tests":{"mechanismAssertions":["In solve mode the candidate registers exactly one section named candidate:identity.","In propose mode the candidate registers exactly one section named candidate:proposal-policy.","In solve mode the candidate:identity text grounds the agent in the verifier-checked artifact."],"preservationAssertions":["Disposing the candidate fiber removes the registered section and restores the pre-boot inventory exactly."]}}