{"$schema":"https://dsh-evolve-le.local/schemas/candidate.manifest.schema.json","schemaVersion":1,"canonicalParent":"sha256:c7306e0424bfd95bf7c687afe26de48954ba99e6cca88b35330b87e53e14c716","donorCandidates":[],"proposal":{"hypothesis":"Instructing the agent to rerun verification checks until they pass prevents premature exit after a single unverified attempt.","evidenceRefs":["evidence://export/16a338255a23aa60412cc36a811a60115c3a345bce6c4aa6bccbe995b85ef879"],"targetFailureModes":["reward-0-premature-exit"],"expectedBehaviorChange":"Solve-mode prompt now requires repeated verification runs until checks pass, forbidding premature final replies.","regressionRisks":[],"touchedSurfaces":["system-prompt"]},"runtime":{"requiredServices":["systemPrompt"],"optionalServices":[],"newToolNames":[],"supportsModes":["solve","propose"],"promptSections":{"solve":[{"name":"candidate:identity","order":100}],"propose":[{"name":"candidate:proposal-policy","order":100}]}},"tests":{"mechanismAssertions":["In solve mode the candidate registers exactly one section named candidate:identity.","In propose mode the candidate registers exactly one section named candidate:proposal-policy.","In solve mode the candidate:identity text mandates rerunning verification checks until they pass."],"preservationAssertions":["Disposing the candidate fiber removes the registered section and restores the pre-boot inventory exactly."]}}