{"$schema":"https://dsh-evolve-le.local/schemas/candidate.manifest.schema.json","schemaVersion":1,"canonicalParent":"sha256:4a74fa2e64b689a9ba42fded72c074579d33301f247d3ebac91fb4a2274b493c","donorCandidates":[],"proposal":{"hypothesis":"Requiring the agent to confirm the expected output artifact exists on disk before final submission addresses reward-zero failures where no usable artifact was produced.","evidenceRefs":["evidence://export/a5393a5dd8ff2d6a00775a0b5bf8becae60dce226ade63ae39d8838bd1e13502"],"targetFailureModes":["reward-0-missing-artifact"],"expectedBehaviorChange":"Solve-mode prompt now requires locating the task's expected artifact and confirming its presence before final submission, preventing completion claims without a deliverable.","regressionRisks":[],"touchedSurfaces":["system-prompt"]},"runtime":{"requiredServices":["systemPrompt"],"optionalServices":[],"newToolNames":[],"supportsModes":["solve","propose"],"promptSections":{"solve":[{"name":"candidate:identity","order":100}],"propose":[{"name":"candidate:proposal-policy","order":100}]}},"tests":{"mechanismAssertions":["In solve mode the candidate registers exactly one section named candidate:identity.","In propose mode the candidate registers exactly one section named candidate:proposal-policy.","In solve mode the candidate:identity text requires the required artifact to be present before final submission."],"preservationAssertions":["Disposing the candidate fiber removes the registered section and restores the pre-boot inventory exactly."]}}