{"$schema":"https://dsh-evolve-le.local/schemas/candidate.manifest.schema.json","schemaVersion":1,"canonicalParent":"sha256:c7306e0424bfd95bf7c687afe26de48954ba99e6cca88b35330b87e53e14c716","donorCandidates":[],"proposal":{"hypothesis":"Requiring at least one pre-flight shell command in solve mode forces the agent to engage the task workspace instead of terminating after identity framing.","evidenceRefs":["evidence://export/99865c7f46a73e27d55243b24feb2651dcc07bf8298c9ed5689bf2482ec8ec6e"],"targetFailureModes":["reward-0-no-terminal-interaction"],"expectedBehaviorChange":"Solve-mode prompt now mandates an observed shell command before any final reply, preventing identity-only exits.","regressionRisks":[],"touchedSurfaces":["system-prompt"]},"runtime":{"requiredServices":["systemPrompt"],"optionalServices":[],"newToolNames":[],"supportsModes":["solve","propose"],"promptSections":{"solve":[{"name":"candidate:identity","order":100}],"propose":[{"name":"candidate:proposal-policy","order":100}]}},"tests":{"mechanismAssertions":["In solve mode the candidate registers exactly one section named candidate:identity.","In propose mode the candidate registers exactly one section named candidate:proposal-policy.","In solve mode the candidate:identity text mandates at least one pre-flight shell command before finishing."],"preservationAssertions":["Disposing the candidate fiber removes the registered section and restores the pre-boot inventory exactly."]}}